{
  "schema": "share-sources-pin/v1",
  "schema_version": 1,
  "ship_allowed": true,
  "ship_allowed_stamp_text": "Publication authorized for the scrubbed v1.3.0 collaborator release on 2026-09-09; distribution gates remain required.",
  "skills_pin": {
    "tag": "v1.3.0",
    "commit": "f14c94cb7715"
  },
  "pins": [
    {
      "repo": "anchor",
      "tag": "v1.3.0",
      "commit": "1837142beb92"
    },
    {
      "repo": "trio",
      "tag": "v1.3.0",
      "commit": "b9539da9f3fd"
    },
    {
      "repo": "skill-foundry",
      "tag": "v1.3.0",
      "commit": "f14c94cb7715"
    }
  ],
  "package_versions": {
    "A": "1.3.0",
    "B": "1.3.0"
  },
  "scrub_tool_versions": {
    "vendor_skills.py": "GREEN-share-distro",
    "distro.py": "GREEN-share-distro"
  }
}
